{
  "$schema": "https://json-schema.org/draft/2020-12/schema",
  "$id": "https://demo.wizardgang.ai/contracts/assurance/iso-27001-compliance.schema.json",
  "title": "ISO/IEC 27001:2022 Public Compliance Dataset",
  "type": "object",
  "additionalProperties": false,
  "required": [
    "schemaVersion",
    "id",
    "visibility",
    "paraphraseNotice",
    "sourceSoa",
    "records"
  ],
  "properties": {
    "schemaVersion": {
      "const": 1
    },
    "id": {
      "const": "iso-iec-27001-2022-public-compliance"
    },
    "visibility": {
      "const": "public"
    },
    "paraphraseNotice": {
      "type": "string",
      "minLength": 1
    },
    "sourceSoa": {
      "type": "object",
      "additionalProperties": false,
      "required": [
        "id",
        "governanceDocumentReference",
        "status",
        "approval"
      ],
      "properties": {
        "id": {
          "const": "WG-SOA-001"
        },
        "governanceDocumentReference": {
          "const": "WG-SOA-001"
        },
        "status": {
          "const": "approved"
        },
        "approval": {
          "type": "object",
          "additionalProperties": false,
          "required": [
            "pullRequest",
            "mergeCommit"
          ],
          "properties": {
            "pullRequest": {
              "type": "integer",
              "minimum": 1
            },
            "mergeCommit": {
              "type": "string",
              "pattern": "^[0-9a-f]{40}$"
            }
          }
        }
      }
    },
    "records": {
      "type": "array",
      "minItems": 1,
      "items": {
        "type": "object",
        "additionalProperties": false,
        "required": [
          "id",
          "reference",
          "title",
          "kind",
          "section",
          "status",
          "applicability",
          "rationale",
          "relationships"
        ],
        "properties": {
          "id": {
            "type": "string",
            "pattern": "^ISO27001-[A0-9.]+$"
          },
          "reference": {
            "type": "string",
            "pattern": "^(?:[4-9]|10)\\.[0-9]+(?:\\.[0-9]+)?$|^A\\.[0-9]+(?:\\.[0-9]+)+$"
          },
          "title": {
            "type": "string",
            "minLength": 1,
            "maxLength": 80
          },
          "kind": {
            "enum": [
              "clause",
              "control"
            ]
          },
          "section": {
            "type": "string",
            "minLength": 1
          },
          "status": {
            "enum": [
              "pass",
              "partial",
              "gap",
              "not-applicable"
            ]
          },
          "applicability": {
            "enum": [
              "applicable",
              "not-applicable"
            ]
          },
          "rationale": {
            "type": "string",
            "minLength": 10
          },
          "relationships": {
            "$ref": "./relationships.schema.json"
          },
          "gaps": {
            "type": "array",
            "minItems": 1,
            "items": {
              "type": "string",
              "minLength": 1
            }
          }
        },
        "allOf": [
          {
            "if": {
              "properties": {
                "status": {
                  "const": "not-applicable"
                }
              },
              "required": [
                "status"
              ]
            },
            "then": {
              "properties": {
                "applicability": {
                  "const": "not-applicable"
                }
              }
            }
          },
          {
            "if": {
              "properties": {
                "status": {
                  "enum": [
                    "partial",
                    "gap"
                  ]
                }
              },
              "required": [
                "status"
              ]
            },
            "then": {
              "required": [
                "gaps"
              ]
            }
          },
          {
            "if": {
              "properties": {
                "status": {
                  "enum": [
                    "pass",
                    "partial",
                    "not-applicable"
                  ]
                }
              },
              "required": [
                "status"
              ]
            },
            "then": {
              "properties": {
                "relationships": {
                  "contains": {
                    "type": "object",
                    "properties": {
                      "relation": {
                        "const": "documentation"
                      }
                    },
                    "required": [
                      "relation"
                    ]
                  },
                  "minContains": 1
                }
              }
            }
          },
          {
            "if": {
              "properties": {
                "kind": {
                  "const": "clause"
                }
              },
              "required": [
                "kind"
              ]
            },
            "then": {
              "properties": {
                "status": {
                  "enum": [
                    "pass",
                    "partial",
                    "gap"
                  ]
                },
                "applicability": {
                  "const": "applicable"
                }
              }
            }
          }
        ]
      }
    }
  }
}
