{
  "schemaVersion": 1,
  "id": "iso-iec-27001-2022-public-compliance",
  "visibility": "public",
  "paraphraseNotice": "Clause and control labels are short original paraphrases; normative ISO text is not reproduced.",
  "sourceSoa": {
    "id": "WG-SOA-001",
    "governanceDocumentReference": "WG-SOA-001",
    "status": "approved",
    "approval": {
      "pullRequest": 56,
      "mergeCommit": "1ae105da8ab6466e334a2faf4e6c63f5885c91df"
    }
  },
  "records": [
    {
      "id": "ISO27001-4.1",
      "reference": "4.1",
      "title": "Understand the operating environment",
      "kind": "clause",
      "section": "Clauses 4–10",
      "status": "partial",
      "applicability": "applicable",
      "relationships": [
        {
          "relation": "evidence",
          "from": {
            "source": "github.structured-records.compliance.iso-27001",
            "native": "ISO27001-4.1"
          },
          "to": {
            "source": "github.structured-records.evidence",
            "native": "EVD-DOC-003"
          }
        },
        {
          "relation": "documentation",
          "from": {
            "source": "github.structured-records.compliance.iso-27001",
            "native": "ISO27001-4.1"
          },
          "to": {
            "source": "github.repository-markdown",
            "native": "docs/governance/GOVERNANCE.md#31-climate-change-relevance"
          }
        }
      ],
      "rationale": "Context, including a 2024 climate-change relevance determination, is documented for the scoped service and its providers. The first scheduled context/management review has not yet operated, so recurring effectiveness is not demonstrated.",
      "gaps": [
        "Complete a dated context review through management review or an equivalent operating record after the defined interval or trigger."
      ]
    },
    {
      "id": "ISO27001-4.2",
      "reference": "4.2",
      "title": "Identify stakeholder security needs",
      "kind": "clause",
      "section": "Clauses 4–10",
      "status": "partial",
      "applicability": "applicable",
      "relationships": [
        {
          "relation": "evidence",
          "from": {
            "source": "github.structured-records.compliance.iso-27001",
            "native": "ISO27001-4.2"
          },
          "to": {
            "source": "github.structured-records.evidence",
            "native": "EVD-DOC-003"
          }
        },
        {
          "relation": "documentation",
          "from": {
            "source": "github.structured-records.compliance.iso-27001",
            "native": "ISO27001-4.2"
          },
          "to": {
            "source": "github.repository-markdown",
            "native": "docs/governance/GOVERNANCE.md#41-climate-related-interested-party-requirements"
          }
        }
      ],
      "rationale": "Interested parties and requirement categories, including the 2024 climate-related requirement consideration, are documented. No specific climate-related stakeholder requirement is currently identified, and the first scheduled interested-party review has not yet operated.",
      "gaps": [
        "Complete a dated interested-party/requirements review and retain any resulting obligation or supplier changes."
      ]
    },
    {
      "id": "ISO27001-4.3",
      "reference": "4.3",
      "title": "Define the security management scope",
      "kind": "clause",
      "section": "Clauses 4–10",
      "status": "partial",
      "applicability": "applicable",
      "relationships": [
        {
          "relation": "evidence",
          "from": {
            "source": "github.structured-records.compliance.iso-27001",
            "native": "ISO27001-4.3"
          },
          "to": {
            "source": "github.structured-records.evidence",
            "native": "EVD-DOC-003"
          }
        },
        {
          "relation": "documentation",
          "from": {
            "source": "github.structured-records.compliance.iso-27001",
            "native": "ISO27001-4.3"
          },
          "to": {
            "source": "github.repository-markdown",
            "native": "docs/governance/GOVERNANCE.md#5-scope"
          }
        }
      ],
      "rationale": "The ISMS boundary, inclusions, exclusions, provider interfaces, and applicability rules are documented. Continued suitability has not yet been confirmed through the first management review.",
      "gaps": [
        "Complete the first management review and retain the scope-suitability decision."
      ]
    },
    {
      "id": "ISO27001-4.4",
      "reference": "4.4",
      "title": "Operate the security management system",
      "kind": "clause",
      "section": "Clauses 4–10",
      "status": "partial",
      "applicability": "applicable",
      "relationships": [
        {
          "relation": "evidence",
          "from": {
            "source": "github.structured-records.compliance.iso-27001",
            "native": "ISO27001-4.4"
          },
          "to": {
            "source": "github.structured-records.evidence",
            "native": "EVD-DOC-001"
          }
        },
        {
          "relation": "documentation",
          "from": {
            "source": "github.structured-records.compliance.iso-27001",
            "native": "ISO27001-4.4"
          },
          "to": {
            "source": "github.repository-markdown",
            "native": "docs/governance/GOVERNANCE.md#6-management-system-model"
          }
        }
      ],
      "rationale": "The ISMS operating model, controlled Git lifecycle, risk process, evidence model, and improvement interfaces are documented and used. Formal internal audit and the first management review remain incomplete.",
      "gaps": [
        "Complete an appropriately objective internal audit and the first management review without converting owner self-review into an audit."
      ]
    },
    {
      "id": "ISO27001-5.1",
      "reference": "5.1",
      "title": "Leadership accountability for security",
      "kind": "clause",
      "section": "Clauses 4–10",
      "status": "partial",
      "applicability": "applicable",
      "relationships": [
        {
          "relation": "evidence",
          "from": {
            "source": "github.structured-records.compliance.iso-27001",
            "native": "ISO27001-5.1"
          },
          "to": {
            "source": "github.structured-records.evidence",
            "native": "EVD-DOC-003"
          }
        },
        {
          "relation": "documentation",
          "from": {
            "source": "github.structured-records.compliance.iso-27001",
            "native": "ISO27001-5.1"
          },
          "to": {
            "source": "github.repository-markdown",
            "native": "docs/governance/GOVERNANCE.md#7-leadership-and-accountability"
          }
        }
      ],
      "rationale": "Leadership/accountability duties and decision rights are documented and reflected in controlled changes. The first management review and recurring leadership review evidence remain incomplete.",
      "gaps": [
        "Complete the first management review and retain attributable decisions/resources/actions."
      ]
    },
    {
      "id": "ISO27001-5.2",
      "reference": "5.2",
      "title": "Set and maintain security policy",
      "kind": "clause",
      "section": "Clauses 4–10",
      "status": "partial",
      "applicability": "applicable",
      "relationships": [
        {
          "relation": "evidence",
          "from": {
            "source": "github.structured-records.compliance.iso-27001",
            "native": "ISO27001-5.2"
          },
          "to": {
            "source": "github.structured-records.evidence",
            "native": "EVD-DOC-003"
          }
        },
        {
          "relation": "documentation",
          "from": {
            "source": "github.structured-records.compliance.iso-27001",
            "native": "ISO27001-5.2"
          },
          "to": {
            "source": "github.repository-markdown",
            "native": "docs/governance/INFORMATION-SECURITY-POLICY.md#3-policy-commitments"
          }
        }
      ],
      "rationale": "The information-security policy is approved and available in the governed repository. The planned security-policy awareness record AW-001 has not been completed.",
      "gaps": [
        "Complete AW-001 and retain dated awareness evidence."
      ]
    },
    {
      "id": "ISO27001-5.3",
      "reference": "5.3",
      "title": "Assign security roles and authority",
      "kind": "clause",
      "section": "Clauses 4–10",
      "status": "partial",
      "applicability": "applicable",
      "relationships": [
        {
          "relation": "evidence",
          "from": {
            "source": "github.structured-records.compliance.iso-27001",
            "native": "ISO27001-5.3"
          },
          "to": {
            "source": "github.structured-records.evidence",
            "native": "EVD-DOC-003"
          }
        },
        {
          "relation": "documentation",
          "from": {
            "source": "github.structured-records.compliance.iso-27001",
            "native": "ISO27001-5.3"
          },
          "to": {
            "source": "github.repository-markdown",
            "native": "docs/governance/GOVERNANCE.md#8-roles-authorities-and-independence"
          }
        }
      ],
      "rationale": "Security roles, authorities, delegation, and independence limits are documented. Competence review remains incomplete and formal internal-audit independence has not yet been demonstrated.",
      "gaps": [
        "Complete the planned competence review and use a sufficiently objective reviewer for any formal internal audit."
      ]
    },
    {
      "id": "ISO27001-6.1",
      "reference": "6.1",
      "title": "Plan for security risks and opportunities",
      "kind": "clause",
      "section": "Clauses 4–10",